id;ru;en
TOURCH_EQUIP;Эй, а мой меч!? Чертов колдун.;Hey, and my sword!? A goddamn sorcerer.
FIRST_LEVEL_GEAR_NO_TEXT;Механизм заработал;The mechanism worked
FIRST_LEVEL_GEAR_YES_TEXT;Хм… похоже, здесь чего-то не хватает.;Hmm ... looks like something's missing here.
LEVEL_ONE_SWORD_EQUIP;Меч! Теперь не голыми кулаками махать.;A sword! No more waving your bare fists.
LEVEL_ONE_BOSS_VISIBLE;А вот и недостающая деталь, осталось ее только достать…;And here is the missing part, it remains only to get it…
KNIGHT_DOOR_NO_KEY_TEXT;Дверь заперта, нужно найти ключ;The door is locked, need to find the key
KNIGHT_DOOR_YES_KEY_TEXT;Надеюсь, этот ключ подойдет. Ура!;I hope this key fits. Hurray!
DOOR_CLOSED_UNDER_TEXT;Похоже эта дверь заперта изнутри;Looks like this door is locked from the inside